ID,CourseContentId,IdContent,QuestionType,QuestionContent,AAnswer,BAnswer,CAnswer,DAnswer,Answer,ResultAnswer,Explanation
1,Chương_1_Tiết 5 Hạ tầng Thanh toán và An toàn thông tin,1,1,"Vai trò chính của một ""Cổng thanh toán"" (Payment Gateway) trong thương mại điện tử là gì?",Cung cấp dịch vụ vận chuyển hàng hóa.,Trung gian xử lý giao dịch điện tử.,Phát hành thẻ tín dụng cho người mua.,Quản lý kho hàng cho người bán.,B,Trung gian xử lý giao dịch điện tử.,Cổng thanh toán (Payment Gateway/PSP) là bên thứ ba cung cấp kết nối điện tử và dịch vụ xử lý giao dịch giữa các bên tham gia thanh toán.
2,Chương_1_Tiết 5 Hạ tầng Thanh toán và An toàn thông tin,1,1,"Giao thức bảo mật nào thường được nhận biết qua biểu tượng ""ổ khóa"" và tiền tố ""https://"" trên trình duyệt?",FTP.,SSL/TLS.,TCP/IP.,SMTP.,B,SSL/TLS.,"SSL (Secure Sockets Layer) và phiên bản kế nhiệm TLS được sử dụng để mã hóa dữ liệu truyền tải, biểu thị bằng https:// và biểu tượng ổ khóa."
3,Chương_1_Tiết 5 Hạ tầng Thanh toán và An toàn thông tin,1,1,"Đặc điểm chính của ""Ví điện tử"" (Digital Wallet) như Apple Pay hay Google Pay là gì?",Chỉ dùng được khi có kết nối dây cáp.,Lưu trữ thông tin thanh toán kỹ thuật số.,In tiền giấy trực tiếp từ điện thoại.,Thay thế hoàn toàn tài khoản ngân hàng.,B,Lưu trữ thông tin thanh toán kỹ thuật số.,Ví điện tử di động lưu trữ thông tin thẻ tín dụng/ghi nợ và cho phép thực hiện thanh toán qua thiết bị di động.
4,Chương_1_Tiết 5 Hạ tầng Thanh toán và An toàn thông tin,1,1,"Mã độc ""Phishing"" (Tấn công giả mạo) chủ yếu nhằm mục đích gì?",Làm hỏng phần cứng máy tính.,Lừa người dùng tiết lộ thông tin mật.,Tăng tốc độ truy cập Internet.,Tạo ra các quảng cáo hợp pháp.,B,Lừa người dùng tiết lộ thông tin mật.,Phishing là hành vi giả mạo một thực thể đáng tin cậy để lừa người dùng tiết lộ thông tin nhạy cảm như mật khẩu hoặc số thẻ tín dụng.
5,Chương_1_Tiết 5 Hạ tầng Thanh toán và An toàn thông tin,1,1,Công nghệ NFC (Near Field Communication) thường được ứng dụng trong loại hình thanh toán nào?,Thanh toán bằng séc giấy.,Thanh toán không tiếp xúc.,Chuyển khoản qua ngân hàng.,Thanh toán khi nhận hàng (COD).,B,Thanh toán không tiếp xúc.,NFC cho phép thanh toán không tiếp xúc (proximity payments) bằng cách vẫy thiết bị di động hoặc thẻ gần đầu đọc.
6,Chương_1_Tiết 5 Hạ tầng Thanh toán và An toàn thông tin,1,1,"Trong bảo mật thông tin, ""Firewall"" (Tường lửa) có chức năng chính là gì?",Diệt virus trên ổ cứng.,Ngăn chặn truy cập mạng trái phép.,Tăng dung lượng lưu trữ dữ liệu.,Khôi phục mật khẩu bị mất.,B,Ngăn chặn truy cập mạng trái phép.,Tường lửa là rào cản phần cứng hoặc phần mềm được thiết kế để ngăn chặn truy cập trái phép vào hoặc ra khỏi mạng riêng.
7,Chương_1_Tiết 5 Hạ tầng Thanh toán và An toàn thông tin,1,1,Loại thẻ nào yêu cầu người dùng phải nạp tiền trước vào tài khoản thẻ để sử dụng?,Thẻ tín dụng (Credit Card).,Thẻ lưu trữ giá trị (Stored-value Card).,Thẻ ghi nợ (Debit Card).,Thẻ hậu mãi (Charge Card).,B,Thẻ lưu trữ giá trị (Stored-value Card).,"Thẻ lưu trữ giá trị (như thẻ quà tặng, thẻ xe buýt) là loại thẻ mà giá trị tiền tệ được nạp trước (prepaid) vào thẻ."
8,Chương_1_Tiết 5 Hạ tầng Thanh toán và An toàn thông tin,1,1,"Trong quy trình xử lý thẻ, bước ""Authorization"" (Ủy quyền) thực hiện nhiệm vụ gì?",Chuyển tiền vào tài khoản người bán.,Xác minh thẻ hợp lệ và đủ hạn mức.,In hóa đơn giấy cho khách hàng.,Gửi hàng hóa cho đơn vị vận chuyển.,B,Xác minh thẻ hợp lệ và đủ hạn mức.,Authorization xác định xem thẻ của người mua có hợp lệ không và có đủ tiền/tín dụng để thanh toán hay không.
9,Chương_1_Tiết 5 Hạ tầng Thanh toán và An toàn thông tin,1,1,"Tại sao ""Micropayments"" (Thanh toán giá trị nhỏ) thường khó thực hiện qua thẻ tín dụng truyền thống?",Do tốc độ mạng Internet quá chậm.,Do phí giao dịch cao so với giá trị món hàng.,Do thẻ tín dụng không hỗ trợ số lẻ.,Do khách hàng không thích dùng thẻ.,B,Do phí giao dịch cao so với giá trị món hàng.,"Đối với các nhà cung cấp, thẻ tín dụng quá đắt đỏ để xử lý các khoản thanh toán nhỏ (dưới 10$) do phí giao dịch cố định."
10,Chương_1_Tiết 5 Hạ tầng Thanh toán và An toàn thông tin,1,1,"Theo mô hình CIA trong an toàn thông tin, ""Integrity"" (Tính toàn vẹn) đảm bảo điều gì?",Dữ liệu luôn có sẵn khi cần.,Dữ liệu không bị thay đổi trái phép.,Dữ liệu được mã hóa hoàn toàn.,Dữ liệu thuộc về người sở hữu.,B,Dữ liệu không bị thay đổi trái phép.,"Tính toàn vẹn (Integrity) đảm bảo rằng dữ liệu chính xác và không bị thay đổi, xóa hoặc tạo mới trái phép trong quá trình truyền tải."
11,Chương_1_Tiết 5 Hạ tầng Thanh toán và An toàn thông tin,1,1,Sự khác biệt chính giữa Thẻ thông minh (Smart Card) và Thẻ từ truyền thống là gì?,Thẻ thông minh làm bằng kim loại.,Thẻ thông minh có chip vi xử lý nhúng.,Thẻ thông minh kích thước lớn hơn.,Thẻ thông minh không cần mật khẩu.,B,Thẻ thông minh có chip vi xử lý nhúng.,"Thẻ thông minh chứa dữ liệu trong một vi mạch (microchip) nhúng, có khả năng xử lý và lưu trữ tốt hơn dải từ."
12,Chương_1_Tiết 5 Hạ tầng Thanh toán và An toàn thông tin,1,1,PayPal hoạt động theo mô hình nào để bảo vệ thông tin tài chính của người dùng?,Yêu cầu người dùng gửi tiền mặt.,Hoạt động như một trung gian thanh toán.,Bắt buộc người dùng dùng thẻ Visa.,Công khai số thẻ để đối chiếu.,B,Hoạt động như một trung gian thanh toán.,"PayPal hoạt động như một cổng thanh toán trung gian, người mua trả tiền qua PayPal nên không cần tiết lộ thông tin thẻ trực tiếp cho người bán."
13,Chương_1_Tiết 5 Hạ tầng Thanh toán và An toàn thông tin,1,1,"""Tokenization"" (Mã hóa token) trong thanh toán giúp tăng cường bảo mật bằng cách nào?",Thay thế số thẻ thật bằng mã định danh ảo.,Yêu cầu khách hàng gửi thẻ qua bưu điện.,Sử dụng dấu vân tay để mở khóa điện thoại.,Chặn tất cả các giao dịch quốc tế.,A,Thay thế số thẻ thật bằng mã định danh ảo.,Tokenization thay thế dữ liệu nhạy cảm (như số thẻ) bằng các ký hiệu định danh (token) để nếu bị đánh cắp thì kẻ gian cũng không dùng được. (Kiến thức bổ trợ từ ngữ cảnh bảo mật thanh toán hiện đại).
14,Chương_1_Tiết 5 Hạ tầng Thanh toán và An toàn thông tin,1,1,Loại tấn công mạng nào sử dụng mạng lưới các máy tính bị nhiễm mã độc (Botnet) để làm tê liệt hệ thống mục tiêu?,Phishing.,DDoS (Tấn công từ chối dịch vụ).,SQL Injection.,Ransomware.,B,DDoS (Tấn công từ chối dịch vụ).,Tấn công DDoS (Distributed Denial of Service) sử dụng mạng lưới botnet để gửi lượng dữ liệu khổng lồ làm quá tải hệ thống.
15,Chương_1_Tiết 5 Hạ tầng Thanh toán và An toàn thông tin,1,1,"Trong hệ thống mã hóa khóa công khai (Public Key Encryption), nếu A muốn gửi tin nhắn bảo mật chỉ cho B đọc, A sẽ dùng khóa nào để mã hóa?",,,Khóa riêng của,Khóa công khai của A.,B,,"Để đảm bảo tính bảo mật (chỉ B đọc được), A dùng khóa công khai của B để mã hóa. Chỉ khóa riêng của B mới giải mã được."
16,Chương_1_Tiết 5 Hạ tầng Thanh toán và An toàn thông tin,1,1,"""Non-repudiation"" (Tính không thể chối bỏ) trong giao dịch điện tử có vai trò gì?",Ngăn chặn hacker xem trộm dữ liệu.,Ngăn các bên phủ nhận hành động đã thực hiện.,Đảm bảo hệ thống luôn hoạt động 24/7.,Xác thực danh tính người dùng bằng mật khẩu.,B,Ngăn các bên phủ nhận hành động đã thực hiện.,Non-repudiation đảm bảo rằng người gửi hoặc người nhận không thể chối bỏ (phủ nhận) việc họ đã thực hiện giao dịch hoặc gửi tin nhắn.
17,Chương_1_Tiết 5 Hạ tầng Thanh toán và An toàn thông tin,1,1,Tại sao các ví điện tử dựa trên đám mây (Cloud-based wallets) dễ triển khai hơn ví dựa trên thiết bị (Device-based)?,Vì chúng không cần kết nối Internet.,Vì chúng ít phụ thuộc vào phần cứng điện thoại.,Vì chúng không cần liên kết ngân hàng.,Vì chúng bảo mật kém hơn.,B,Vì chúng ít phụ thuộc vào phần cứng điện thoại.,Ví dựa trên đám mây (như dùng mã QR) không yêu cầu phần cứng đặc biệt như chip NFC trên điện thoại hay thiết bị đọc thẻ phức tạp tại điểm bán.
18,Chương_1_Tiết 5 Hạ tầng Thanh toán và An toàn thông tin,1,1,"Lợi ích lớn nhất của việc sử dụng ""Chữ ký số"" (Digital Signature) so với chữ ký quét (scanned signature) là gì?",Đẹp hơn về mặt thẩm mỹ.,Đảm bảo tính toàn vẹn và xác thực.,Dễ dàng sao chép để dùng nhiều lần.,Không cần phần mềm để đọc.,B,Đảm bảo tính toàn vẹn và xác thực.,"Chữ ký số sử dụng mã hóa để xác thực danh tính người gửi và đảm bảo nội dung không bị thay đổi (tính toàn vẹn), điều mà chữ ký quét ảnh không làm được."
19,Chương_1_Tiết 5 Hạ tầng Thanh toán và An toàn thông tin,1,1,"Trong quy trình thanh toán thẻ, phí ""Interchange Rate"" chủ yếu được trả cho đối tượng nào?",Người bán hàng (Merchant).,Ngân hàng phát hành thẻ (Issuing Bank).,Cổng thanh toán (Payment Gateway).,Khách hàng (Cardholder).,B,Ngân hàng phát hành thẻ (Issuing Bank).,"Phần lớn phí chiết khấu (discount rate) là phí Interchange, được trả cho ngân hàng phát hành thẻ để xử lý giao dịch và chịu rủi ro tín dụng."
20,Chương_1_Tiết 5 Hạ tầng Thanh toán và An toàn thông tin,1,1,"Tấn công ""Man-in-the-middle"" (Người đứng giữa) đe dọa yếu tố nào của an toàn thông tin?",Tính sẵn sàng của hệ thống.,Tính bảo mật và toàn vẹn dữ liệu.,Tốc độ xử lý của máy chủ.,Khả năng lưu trữ của cơ sở dữ liệu.,B,Tính bảo mật và toàn vẹn dữ liệu.,"Kẻ tấn công đứng giữa lén lút chuyển tiếp và có thể thay đổi giao tiếp giữa hai bên, xâm phạm tính bảo mật (đọc trộm) và tính toàn vẹn (sửa đổi)."
